13:44:26.747444 IP 172.20.10.3.57802 > 47.107.123.118.50001: Flags [S], seq 3209465958, win 65535, length 0
13:44:26.902252 IP 47.107.123.118.50001 > 172.20.10.3.57802: Flags [S.], seq 493031910, ack 3209465959, win 28960, length 0
13:44:26.902297 IP 172.20.10.3.57802 > 47.107.123.118.50001: Flags [.], ack 1, win 2064, length 0
13:44:26.902411: read 5120 bytes from stdin
13:44:26.903034 IP 172.20.10.3.57802 > 47.107.123.118.50001: Flags [.], seq 1:1349, ack 1, win 2064, length 1348
13:44:26.903039 IP 172.20.10.3.57802 > 47.107.123.118.50001: Flags [.], seq 1349:2697, ack 1, win 2064, length 1348
13:44:26.903041 IP 172.20.10.3.57802 > 47.107.123.118.50001: Flags [.], seq 2697:4045, ack 1, win 2064, length 1348
13:44:26.903053: wrote 5120 bytes to server
13:44:26.903094: read 5120 bytes from stdin
13:44:26.903116: wrote 5120 bytes to server
13:44:26.903141: read 5120 bytes from stdin
13:44:26.903159: wrote 5120 bytes to server
13:44:26.903182: read 5120 bytes from stdin
13:44:26.903201: wrote 5120 bytes to server
13:44:26.903223: read 5120 bytes from stdin
13:44:26.903241: wrote 5120 bytes to server
13:44:26.903263: read 5120 bytes from stdin
13:44:26.903282: wrote 5120 bytes to server
13:44:26.903305: read 5120 bytes from stdin
13:44:26.903324: wrote 5120 bytes to server
13:44:26.903346: read 5120 bytes from stdin
13:44:26.903364: wrote 5120 bytes to server
13:44:26.903386: read 5120 bytes from stdin
13:44:26.903404: wrote 5120 bytes to server
13:44:26.903426: read 3920 bytes from stdin
13:44:26.903445: wrote 3920 bytes to server
13:44:26.903522: all data from client finished!
13:44:26.903578: send FIN to server
13:44:27.062338 IP 47.107.123.118.50001 > 172.20.10.3.57802: Flags [.], ack 1349, win 249, length 0
13:44:27.062338 IP 47.107.123.118.50001 > 172.20.10.3.57802: Flags [P.], seq 1:1025, ack 1349, win 249, length 1024
13:44:27.062386 IP 172.20.10.3.57802 > 47.107.123.118.50001: Flags [.], seq 4045:5393, ack 1, win 2064, length 1348
13:44:27.062391 IP 172.20.10.3.57802 > 47.107.123.118.50001: Flags [.], seq 5393:6741, ack 1, win 2064, length 1348
13:44:27.062404 IP 172.20.10.3.57802 > 47.107.123.118.50001: Flags [.], seq 6741:7077, ack 1025, win 2048, length 336
13:44:27.062440: read 1024 bytes from server
13:44:27.062524: wrote 1024 bytes to stdout
13:44:27.062535 IP 47.107.123.118.50001 > 172.20.10.3.57802: Flags [P.], seq 1025:2373, ack 2697, win 272, length 1348
13:44:27.062561 IP 172.20.10.3.57802 > 47.107.123.118.50001: Flags [.], seq 7077:8425, ack 2373, win 2027, length 1348
13:44:27.062566 IP 172.20.10.3.57802 > 47.107.123.118.50001: Flags [.], seq 8425:9773, ack 2373, win 2027, length 1348
13:44:27.062585: read 1348 bytes from server
13:44:27.062623: wrote 1348 bytes to stdout
13:44:27.069273 IP 47.107.123.118.50001 > 172.20.10.3.57802: Flags [P.], seq 2373:3721, ack 4045, win 295, length 1348
13:44:27.069322 IP 172.20.10.3.57802 > 47.107.123.118.50001: Flags [.], seq 9773:11121, ack 3721, win 2026, length 1348
13:44:27.069337 IP 172.20.10.3.57802 > 47.107.123.118.50001: Flags [.], seq 11121:12469, ack 3721, win 2026, length 1348
13:44:27.069364: read 1348 bytes from server
13:44:27.069456: wrote 1348 bytes to stdout
13:44:27.251722 IP 47.107.123.118.50001 > 172.20.10.3.57802: Flags [P.], seq 3721:5069, ack 5393, win 317, length 1348
13:44:27.251787 IP 172.20.10.3.57802 > 47.107.123.118.50001: Flags [.], seq 12469:13817, ack 5069, win 2026, length 1348
13:44:27.251793 IP 172.20.10.3.57802 > 47.107.123.118.50001: Flags [.], seq 13817:15165, ack 5069, win 2026, length 1348
13:44:27.251820: read 1348 bytes from server
13:44:27.251919: wrote 1348 bytes to stdout
13:44:27.270167 IP 47.107.123.118.50001 > 172.20.10.3.57802: Flags [P.], seq 5069:5393, ack 7077, win 361, length 324
13:44:27.270174 IP 47.107.123.118.50001 > 172.20.10.3.57802: Flags [.], seq 5393:6741, ack 7077, win 361, length 1348
13:44:27.270238 IP 172.20.10.3.57802 > 47.107.123.118.50001: Flags [.], seq 15165:16513, ack 5393, win 2042, length 1348
13:44:27.270255 IP 172.20.10.3.57802 > 47.107.123.118.50001: Flags [.], seq 16513:17861, ack 5393, win 2042, length 1348
13:44:27.270324: read 1672 bytes from server
13:44:27.270440: wrote 1672 bytes to stdout
13:44:27.273867 IP 47.107.123.118.50001 > 172.20.10.3.57802: Flags [.], seq 6741:8089, ack 8425, win 384, length 1348
13:44:27.273944 IP 172.20.10.3.57802 > 47.107.123.118.50001: Flags [.], seq 17861:19209, ack 8089, win 2026, length 1348
13:44:27.273952 IP 172.20.10.3.57802 > 47.107.123.118.50001: Flags [.], seq 19209:20557, ack 8089, win 2026, length 1348
13:44:27.274406: read 1348 bytes from server
13:44:27.274484: wrote 1348 bytes to stdout
13:44:27.280472 IP 47.107.123.118.50001 > 172.20.10.3.57802: Flags [.], seq 8089:9437, ack 9773, win 406, length 1348
13:44:27.280475 IP 47.107.123.118.50001 > 172.20.10.3.57802: Flags [.], seq 9437:10785, ack 11121, win 429, length 1348
13:44:27.280500 IP 172.20.10.3.57802 > 47.107.123.118.50001: Flags [.], seq 20557:21905, ack 9437, win 2026, length 1348
13:44:27.280512 IP 172.20.10.3.57802 > 47.107.123.118.50001: Flags [.], seq 21905:23253, ack 9437, win 2026, length 1348
13:44:27.280523 IP 172.20.10.3.57802 > 47.107.123.118.50001: Flags [.], seq 23253:24601, ack 10785, win 2005, length 1348
13:44:27.280530 IP 172.20.10.3.57802 > 47.107.123.118.50001: Flags [.], seq 24601:25949, ack 10785, win 2005, length 1348
13:44:27.280579 IP 172.20.10.3.57802 > 47.107.123.118.50001: Flags [.], seq 25949:26621, ack 10785, win 2048, length 672
13:44:27.280605: read 2696 bytes from server
13:44:27.280717: wrote 2696 bytes to stdout
13:44:27.281577 IP 47.107.123.118.50001 > 172.20.10.3.57802: Flags [.], seq 10785:12133, ack 12469, win 451, length 1348
13:44:27.281660 IP 172.20.10.3.57802 > 47.107.123.118.50001: Flags [.], seq 26621:27969, ack 12133, win 2026, length 1348
13:44:27.281673 IP 172.20.10.3.57802 > 47.107.123.118.50001: Flags [.], seq 27969:29317, ack 12133, win 2026, length 1348
13:44:27.281740: read 1348 bytes from server
13:44:27.281823: wrote 1348 bytes to stdout
13:44:27.471193 IP 47.107.123.118.50001 > 172.20.10.3.57802: Flags [.], seq 12133:13481, ack 13817, win 474, length 1348
13:44:27.471306 IP 172.20.10.3.57802 > 47.107.123.118.50001: Flags [.], seq 29317:30665, ack 13481, win 2026, length 1348
13:44:27.471335 IP 172.20.10.3.57802 > 47.107.123.118.50001: Flags [.], seq 30665:32013, ack 13481, win 2026, length 1348
13:44:27.471405: read 1348 bytes from server
13:44:27.471535 IP 47.107.123.118.50001 > 172.20.10.3.57802: Flags [.], seq 13481:14829, ack 15165, win 497, length 1348
13:44:27.471541 IP 47.107.123.118.50001 > 172.20.10.3.57802: Flags [P.], seq 14829:15165, ack 16513, win 519, length 336
13:44:27.471567 IP 172.20.10.3.57802 > 47.107.123.118.50001: Flags [.], seq 32013:33361, ack 14829, win 2026, length 1348
13:44:27.471580 IP 172.20.10.3.57802 > 47.107.123.118.50001: Flags [.], seq 33361:34709, ack 14829, win 2026, length 1348
13:44:27.471611 IP 172.20.10.3.57802 > 47.107.123.118.50001: Flags [.], seq 34709:36057, ack 15165, win 2021, length 1348
13:44:27.471621 IP 172.20.10.3.57802 > 47.107.123.118.50001: Flags [.], seq 36057:37405, ack 15165, win 2021, length 1348
13:44:27.471751 IP 47.107.123.118.50001 > 172.20.10.3.57802: Flags [P.], seq 15165:16513, ack 16513, win 519, length 1348
13:44:27.471761 IP 47.107.123.118.50001 > 172.20.10.3.57802: Flags [P.], seq 16513:17861, ack 17861, win 542, length 1348
13:44:27.471780 IP 172.20.10.3.57802 > 47.107.123.118.50001: Flags [.], ack 16513, win 2000, length 0
13:44:27.471805 IP 172.20.10.3.57802 > 47.107.123.118.50001: Flags [.], seq 37405:38753, ack 17861, win 1979, length 1348
13:44:27.471814 IP 172.20.10.3.57802 > 47.107.123.118.50001: Flags [.], seq 38753:40101, ack 17861, win 1979, length 1348
13:44:27.471952: wrote 1348 bytes to stdout
13:44:27.472015 IP 172.20.10.3.57802 > 47.107.123.118.50001: Flags [.], ack 17861, win 2048, length 0
13:44:27.472054: read 4380 bytes from server
13:44:27.472161: wrote 4380 bytes to stdout
13:44:27.475104 IP 47.107.123.118.50001 > 172.20.10.3.57802: Flags [P.], seq 17861:19209, ack 19209, win 563, length 1348
13:44:27.475178 IP 172.20.10.3.57802 > 47.107.123.118.50001: Flags [.], seq 40101:41449, ack 19209, win 2026, length 1348
13:44:27.475192 IP 172.20.10.3.57802 > 47.107.123.118.50001: Flags [.], seq 41449:42797, ack 19209, win 2026, length 1348
13:44:27.475247: read 1348 bytes from server
13:44:27.475342: wrote 1348 bytes to stdout
13:44:27.532513 IP 47.107.123.118.50001 > 172.20.10.3.57802: Flags [.], ack 21905, win 608, length 0
13:44:27.532537 IP 172.20.10.3.57802 > 47.107.123.118.50001: Flags [.], seq 42797:44145, ack 19209, win 2048, length 1348
13:44:27.532543 IP 172.20.10.3.57802 > 47.107.123.118.50001: Flags [.], seq 44145:45493, ack 19209, win 2048, length 1348
13:44:27.532547 IP 172.20.10.3.57802 > 47.107.123.118.50001: Flags [.], seq 45493:46841, ack 19209, win 2048, length 1348
13:44:27.532550 IP 172.20.10.3.57802 > 47.107.123.118.50001: Flags [.], seq 46841:48189, ack 19209, win 2048, length 1348
13:44:27.538277 IP 47.107.123.118.50001 > 172.20.10.3.57802: Flags [.], ack 24601, win 653, length 0
13:44:27.538281 IP 47.107.123.118.50001 > 172.20.10.3.57802: Flags [.], ack 26621, win 697, length 0
13:44:27.538315 IP 172.20.10.3.57802 > 47.107.123.118.50001: Flags [.], seq 48189:49537, ack 19209, win 2048, length 1348
13:44:27.538327 IP 172.20.10.3.57802 > 47.107.123.118.50001: Flags [FP.], seq 49537:50001, ack 19209, win 2048, length 464
13:44:27.538544 IP 47.107.123.118.50001 > 172.20.10.3.57802: Flags [.], ack 29317, win 742, length 0
13:44:27.538651 IP 47.107.123.118.50001 > 172.20.10.3.57802: Flags [.], seq 19209:20557, ack 29317, win 742, length 1348
13:44:27.538673: read 1348 bytes from server
13:44:27.538766: wrote 1348 bytes to stdout
13:44:27.539006 IP 47.107.123.118.50001 > 172.20.10.3.57802: Flags [.], seq 20557:21905, ack 29317, win 742, length 1348
13:44:27.539009 IP 47.107.123.118.50001 > 172.20.10.3.57802: Flags [.], seq 21905:23253, ack 29317, win 742, length 1348
13:44:27.539010 IP 47.107.123.118.50001 > 172.20.10.3.57802: Flags [.], seq 23253:24601, ack 29317, win 742, length 1348
13:44:27.539036 IP 172.20.10.3.57802 > 47.107.123.118.50001: Flags [F.], seq 50001, ack 21905, win 2026, length 0
13:44:27.539047 IP 172.20.10.3.57802 > 47.107.123.118.50001: Flags [F.], seq 50001, ack 24601, win 1984, length 0
13:44:27.539126 IP 172.20.10.3.57802 > 47.107.123.118.50001: Flags [F.], seq 50001, ack 24601, win 2048, length 0
13:44:27.539185: read 4044 bytes from server
13:44:27.539293: wrote 4044 bytes to stdout
13:44:27.539377 IP 47.107.123.118.50001 > 172.20.10.3.57802: Flags [.], seq 24601:25949, ack 29317, win 742, length 1348
13:44:27.539409: read 1348 bytes from server
13:44:27.539429: wrote 1348 bytes to stdout
13:44:27.539858 IP 47.107.123.118.50001 > 172.20.10.3.57802: Flags [.], seq 25949:27297, ack 29317, win 742, length 1348
13:44:27.539860 IP 47.107.123.118.50001 > 172.20.10.3.57802: Flags [.], seq 27297:28645, ack 29317, win 742, length 1348
13:44:27.539901 IP 172.20.10.3.57802 > 47.107.123.118.50001: Flags [F.], seq 50001, ack 27297, win 2026, length 0
13:44:27.539937 IP 172.20.10.3.57802 > 47.107.123.118.50001: Flags [F.], seq 50001, ack 28645, win 2048, length 0
13:44:27.539944: read 2696 bytes from server
13:44:27.540011: wrote 2696 bytes to stdout
13:44:27.614353 IP 47.107.123.118.50001 > 172.20.10.3.57802: Flags [P.], seq 28645:29317, ack 29317, win 742, length 672
13:44:27.614379 IP 172.20.10.3.57802 > 47.107.123.118.50001: Flags [F.], seq 50001, ack 29317, win 2037, length 0
13:44:27.614410: read 672 bytes from server
13:44:27.614527: wrote 672 bytes to stdout
13:44:27.620437 IP 47.107.123.118.50001 > 172.20.10.3.57802: Flags [P.], seq 29317:30665, ack 30665, win 765, length 1348
13:44:27.620439 IP 47.107.123.118.50001 > 172.20.10.3.57802: Flags [P.], seq 30665:32013, ack 32013, win 788, length 1348
13:44:27.620492 IP 172.20.10.3.57802 > 47.107.123.118.50001: Flags [F.], seq 50001, ack 30665, win 2026, length 0
13:44:27.620505 IP 172.20.10.3.57802 > 47.107.123.118.50001: Flags [F.], seq 50001, ack 32013, win 2005, length 0
13:44:27.620543 IP 172.20.10.3.57802 > 47.107.123.118.50001: Flags [F.], seq 50001, ack 32013, win 2048, length 0
13:44:27.620558: read 2696 bytes from server
13:44:27.620665: wrote 2696 bytes to stdout
13:44:27.628119 IP 47.107.123.118.50001 > 172.20.10.3.57802: Flags [P.], seq 32013:33361, ack 33361, win 809, length 1348
13:44:27.628125 IP 47.107.123.118.50001 > 172.20.10.3.57802: Flags [P.], seq 33361:34709, ack 34709, win 831, length 1348
13:44:27.628162 IP 172.20.10.3.57802 > 47.107.123.118.50001: Flags [F.], seq 50001, ack 33361, win 2026, length 0
13:44:27.628202 IP 172.20.10.3.57802 > 47.107.123.118.50001: Flags [F.], seq 50001, ack 34709, win 2005, length 0
13:44:27.628245 IP 172.20.10.3.57802 > 47.107.123.118.50001: Flags [F.], seq 50001, ack 34709, win 2048, length 0
13:44:27.628258 IP 47.107.123.118.50001 > 172.20.10.3.57802: Flags [P.], seq 34709:36057, ack 36057, win 854, length 1348
13:44:27.628279 IP 172.20.10.3.57802 > 47.107.123.118.50001: Flags [F.], seq 50001, ack 36057, win 2026, length 0
13:44:27.628305: read 2696 bytes from server
13:44:27.628421 IP 47.107.123.118.50001 > 172.20.10.3.57802: Flags [P.], seq 36057:37405, ack 37405, win 877, length 1348
13:44:27.628428: wrote 2696 bytes to stdout
13:44:27.628444 IP 172.20.10.3.57802 > 47.107.123.118.50001: Flags [F.], seq 50001, ack 37405, win 2005, length 0
13:44:27.628491 IP 172.20.10.3.57802 > 47.107.123.118.50001: Flags [F.], seq 50001, ack 37405, win 2048, length 0
13:44:27.628498: read 2696 bytes from server
13:44:27.628623: wrote 2696 bytes to stdout
13:44:27.628646 IP 47.107.123.118.50001 > 172.20.10.3.57802: Flags [P.], seq 37405:38753, ack 38753, win 899, length 1348
13:44:27.628663 IP 172.20.10.3.57802 > 47.107.123.118.50001: Flags [F.], seq 50001, ack 38753, win 2026, length 0
13:44:27.628696: read 1348 bytes from server
13:44:27.628726: wrote 1348 bytes to stdout
13:44:27.628746 IP 47.107.123.118.50001 > 172.20.10.3.57802: Flags [P.], seq 38753:40101, ack 40101, win 922, length 1348
13:44:27.628758 IP 172.20.10.3.57802 > 47.107.123.118.50001: Flags [F.], seq 50001, ack 40101, win 2026, length 0
13:44:27.628770: read 1348 bytes from server
13:44:27.628815: wrote 1348 bytes to stdout
13:44:27.634573 IP 47.107.123.118.50001 > 172.20.10.3.57802: Flags [P.], seq 40101:41449, ack 41449, win 944, length 1348
13:44:27.634577 IP 47.107.123.118.50001 > 172.20.10.3.57802: Flags [P.], seq 41449:42797, ack 42797, win 967, length 1348
13:44:27.634611 IP 172.20.10.3.57802 > 47.107.123.118.50001: Flags [F.], seq 50001, ack 41449, win 2026, length 0
13:44:27.634624 IP 172.20.10.3.57802 > 47.107.123.118.50001: Flags [F.], seq 50001, ack 42797, win 2005, length 0
13:44:27.634684 IP 172.20.10.3.57802 > 47.107.123.118.50001: Flags [F.], seq 50001, ack 42797, win 2048, length 0
13:44:27.634704: read 2696 bytes from server
13:44:27.634786: wrote 2696 bytes to stdout
13:44:27.674099 IP 47.107.123.118.50001 > 172.20.10.3.57802: Flags [.], ack 42797, win 967, length 0
13:44:27.674128 IP 172.20.10.3.57802 > 47.107.123.118.50001: Flags [.], seq 42797:44145, ack 42797, win 2048, length 1348
13:44:27.685374 IP 47.107.123.118.50001 > 172.20.10.3.57802: Flags [.], ack 42797, win 967, length 0
13:44:27.685376 IP 47.107.123.118.50001 > 172.20.10.3.57802: Flags [.], ack 42797, win 967, length 0
13:44:27.685407 IP 172.20.10.3.57802 > 47.107.123.118.50001: Flags [.], seq 44145:45493, ack 42797, win 2048, length 1348
13:44:27.685422 IP 172.20.10.3.57802 > 47.107.123.118.50001: Flags [.], seq 45493:46841, ack 42797, win 2048, length 1348
13:44:27.685617 IP 47.107.123.118.50001 > 172.20.10.3.57802: Flags [.], ack 42797, win 967, length 0
13:44:27.685636 IP 172.20.10.3.57802 > 47.107.123.118.50001: Flags [.], seq 46841:48189, ack 42797, win 2048, length 1348
13:44:27.709599 IP 47.107.123.118.50001 > 172.20.10.3.57802: Flags [.], ack 42797, win 967, length 0
13:44:27.709603 IP 47.107.123.118.50001 > 172.20.10.3.57802: Flags [.], ack 44145, win 990, length 0
13:44:27.709641 IP 172.20.10.3.57802 > 47.107.123.118.50001: Flags [.], seq 48189:49537, ack 42797, win 2048, length 1348
13:44:27.709742 IP 47.107.123.118.50001 > 172.20.10.3.57802: Flags [.], seq 42797:44133, ack 44145, win 990, length 1336
13:44:27.709792: read 1336 bytes from server
13:44:27.709852: wrote 1336 bytes to stdout
13:44:27.710927 IP 47.107.123.118.50001 > 172.20.10.3.57802: Flags [.], ack 45493, win 1012, length 0
13:44:27.710997 IP 172.20.10.3.57802 > 47.107.123.118.50001: Flags [FP.], seq 49537:50001, ack 44133, win 2048, length 464
13:44:27.711084 IP 47.107.123.118.50001 > 172.20.10.3.57802: Flags [.], seq 44133:45469, ack 45493, win 1012, length 1336
13:44:27.711087 IP 47.107.123.118.50001 > 172.20.10.3.57802: Flags [.], ack 46841, win 1035, length 0
13:44:27.711088 IP 47.107.123.118.50001 > 172.20.10.3.57802: Flags [.], seq 45469:46805, ack 46841, win 1035, length 1336
13:44:27.711114 IP 172.20.10.3.57802 > 47.107.123.118.50001: Flags [F.], seq 50001, ack 46805, win 2006, length 0
13:44:27.711154: read 2672 bytes from server
13:44:27.711300: wrote 2672 bytes to stdout
13:44:27.712108 IP 47.107.123.118.50001 > 172.20.10.3.57802: Flags [.], ack 48189, win 1058, length 0
13:44:27.712109 IP 47.107.123.118.50001 > 172.20.10.3.57802: Flags [.], seq 46805:48141, ack 48189, win 1058, length 1336
13:44:27.712231 IP 47.107.123.118.50001 > 172.20.10.3.57802: Flags [.], ack 49537, win 1080, length 0
13:44:27.712232 IP 47.107.123.118.50001 > 172.20.10.3.57802: Flags [.], seq 48141:49477, ack 49537, win 1080, length 1336
13:44:27.712258 IP 172.20.10.3.57802 > 47.107.123.118.50001: Flags [F.], seq 50001, ack 49477, win 2006, length 0
13:44:27.712323 IP 47.107.123.118.50001 > 172.20.10.3.57802: Flags [FP.], seq 49477:50001, ack 50002, win 1101, length 524
13:44:27.712376 IP 172.20.10.3.57802 > 47.107.123.118.50001: Flags [.], ack 50002, win 1998, length 0
13:44:27.713471 IP 172.20.10.3.57802 > 47.107.123.118.50001: Flags [.], ack 50002, win 2048, length 0
13:44:27.713555: read 3196 bytes from server
13:44:27.713652: wrote 3196 bytes to stdout
13:44:27.713675: server cut connection
13:44:27.742151 IP 47.107.123.118.50001 > 172.20.10.3.57802: Flags [.], ack 50002, win 1101, length 0
13:44:27.755508 IP 47.107.123.118.50001 > 172.20.10.3.57802: Flags [.], ack 50002, win 1101, length 0
13:44:27.755511 IP 47.107.123.118.50001 > 172.20.10.3.57802: Flags [.], ack 50002, win 1101, length 0
13:44:27.755512 IP 47.107.123.118.50001 > 172.20.10.3.57802: Flags [.], ack 50002, win 1101, length 0
13:44:27.755513 IP 47.107.123.118.50001 > 172.20.10.3.57802: Flags [.], ack 50002, win 1101, length 0
13:44:27.755514 IP 47.107.123.118.50001 > 172.20.10.3.57802: Flags [.], ack 50002, win 1101, length 0
13:44:27.771309 IP 47.107.123.118.50001 > 172.20.10.3.57802: Flags [.], ack 50002, win 1101, length 0
13:44:27.771317 IP 47.107.123.118.50001 > 172.20.10.3.57802: Flags [.], ack 50002, win 1101, length 0
13:44:27.771319 IP 47.107.123.118.50001 > 172.20.10.3.57802: Flags [.], ack 50002, win 1101, length 0
13:44:27.771320 IP 47.107.123.118.50001 > 172.20.10.3.57802: Flags [.], ack 50002, win 1101, length 0
13:44:27.771322 IP 47.107.123.118.50001 > 172.20.10.3.57802: Flags [.], ack 50002, win 1101, length 0
13:44:27.771324 IP 47.107.123.118.50001 > 172.20.10.3.57802: Flags [.], ack 50002, win 1101, length 0
13:44:27.771407 IP 47.107.123.118.50001 > 172.20.10.3.57802: Flags [.], ack 50002, win 1101, length 0
13:44:27.771408 IP 47.107.123.118.50001 > 172.20.10.3.57802: Flags [.], ack 50002, win 1101, length 0
13:44:27.784397 IP 47.107.123.118.50001 > 172.20.10.3.57802: Flags [.], ack 50002, win 1101, length 0
13:44:27.812041 IP 47.107.123.118.50001 > 172.20.10.3.57802: Flags [.], ack 50002, win 1101, length 0
13:44:27.844114 IP 47.107.123.118.50001 > 172.20.10.3.57802: Flags [.], ack 50002, win 1101, length 0
13:44:27.854487 IP 47.107.123.118.50001 > 172.20.10.3.57802: Flags [.], ack 50002, win 1101, length 0
13:44:27.854493 IP 47.107.123.118.50001 > 172.20.10.3.57802: Flags [.], ack 50002, win 1101, length 0
13:44:27.854495 IP 47.107.123.118.50001 > 172.20.10.3.57802: Flags [R], seq 493081912, win 0, length
13:44:27.854497 IP 47.107.123.118.50001 > 172.20.10.3.57802: Flags [R], seq 493074707, win 0, length
13:44:27.854499 IP 47.107.123.118.50001 > 172.20.10.3.57802: Flags [R], seq 493074707, win 0, length
13:44:27.858131 IP 47.107.123.118.50001 > 172.20.10.3.57802: Flags [R], seq 493074707, win 0, length
13:44:27.858134 IP 47.107.123.118.50001 > 172.20.10.3.57802: Flags [R], seq 493076043, win 0, length
